IDEQUIPAMENT,ALIES,NOM,CATEGORIA,TIPUS_VIA,VIA,SUFIX_VIA,NUM,CPOSTAL,POBLACIO,COMARCA,TELEFON1,TELEFON2,FAX,UTMX,UTMY,LONGITUD,LATITUD,EMAIL,WEB,DATA_MODIFICACIO,PROPIETATS,LOCALITZACIO
55422,Heliport de l'Autoritat Portuària de Barcelona,Heliport de l'Autoritat Portuària de Barcelona,"Mobilitat. Transports|Aeroports, aeròdroms i heliports||",(Port BCN), (Port BCN) Moll Adossat s/n,,s/n,08039,Barcelona,Barcelonès,93 224 07 10,,,431668.21,4579518.91,2.182997222222222,41.36428055555555,,,01/31/2018 01:00:03 PM +0000,"Adreça Explotador|Adreça Explotador|Adreça Titular|Pl. Sant Gregori Traumaturg, 8, 2on 1a, 08021 Barcelona|Entitat Gestora|Cat Helicòpters, SL|Explotador|Cat Helicòpters, S.L.|Telèfon explotador|647508938|Tipus|Heliport Restringit Especialitzat|Titular|Cat Helicòpters, S.L.",
55423,Heliport del Reial Automòbil Club de Catalunya,Heliport del Reial Automòbil Club de Catalunya,"Mobilitat. Transports|Aeroports, aeròdroms i heliports||",Avinguda, Avinguda Diagonal  687-689,,687-689,08028,Barcelona,Barcelonès,93 495 50 35,,,425346.68,4581486.02,2.107180555555555,41.381436111111114,,,01/31/2018 01:00:02 PM +0000,"Adreça Titular|Av. Albert Bastardes, 4
Barcelona|Entitat Gestora|Reial Automòbil Club de Catalunya|Explotador|TAF Helicòpters|Telèfon Titular|934955000|Telèfon explotador|934955037|Tipus|Heliport Restringit Especialitzat|Titular|Reial Automòbil Club de Catalunya",
55426,Heliport de l'Hospital de la Santa Creu i Sant Pau,Heliport de l'Hospital de la Santa Creu i Sant Pau,"Mobilitat. Transports|Aeroports, aeròdroms i heliports||",Carrer, Carrer Sant Quintí  89,,89,08026,Barcelona,Barcelonès,,,,431087.11,4585134.43,2.175411111111111,41.41480833333333,,,01/31/2018 01:00:00 PM +0000,"Adreça Titular|Sant Antoni Maria Claret, 167, Barcelona|Entitat Gestora|TAF Helicopters|Explotador|TAF helicòpters|Tipus|Heliport Sanitari Especialitzat|Titular|Fundació Hosp. De Sta. Creu i St. Pau",
759347,Heliport de l'Hospital Teknon,Heliport de l'Hospital Teknon,"Mobilitat. Transports|Aeroports, aeròdroms i heliports||",Carrer, Carrer Vilana 12,,12,08022,Barcelona,Barcelonès,93 290 62 01,,,427120.35,4584269.31,2.12805555555555,41.4066667,,,01/31/2018 12:59:40 PM +0000,"Entitat Gestora|Teknon Healthcare, SL|Explotador|Teknon Healthcare, SL|Tipus|Heliport Sanitari Especialitzat|Titular|HEALTHCARE, SL",
759350,Heliport de l'Hotel Juan Carlos I,Heliport de l'Hotel Juan Carlos I,"Mobilitat. Transports|Aeroports, aeròdroms i heliports||",Av., Av. d'Albert Bastardas,,,08028,Barcelona,Barcelonès,93 640 40 40 40,,,425430.12,4581403.44,2.10805555555555,41.3805556,,,01/31/2018 12:59:38 PM +0000,"Adreça Explotador|Adreça Explotador|Adreça Titular|Av. Diagonal, 661-671, 08028, Barcelona |Entitat Gestora|Hotel Fairmont Rey Juan Carlos I|Explotador|Hotel Fairmont Rey Juan Carlos I|Tipus|Heliport Especialitzat Privat|Titular|Hotel Fairmont Rey Juan Carlos I",
